name,province,city,location,desc,want,has_been,strategy,route,ticket_info,open_time
荣成槎山风景区,山东省,威海市,荣成市,"{'景区简介': ['荣成槎山风景区是山东最具代表性的省级地质公园，也是中国原始地迹遗产保护区、国家级森林公园。槎山九顶连绵，奇峰耸立，山海相映，蔚为壮观。这里一山两教，是道家全真教的发祥地和佛教海岸线第一石窟寺的所在地，自古便有“大东圣境”之美誉，可谓仁山圣水。紧邻海岸的渔家村落质朴非凡，亦洋溢着浓厚的民俗风情。独具特色的滨海景致和人文风光在此交相辉映，让人心旷神怡，流连忘返。'], '景点分布': ['槎山风景区奇景荟萃，不仅有延寿宫、千真洞、云光洞、槎山展室、中外第一山盟海誓亭、聚仙洞、映阳洞等人文景观，还有僧帽顶、莲花顶、释佛石、风动石、水帘洞、九龙池、滴翠洞等自然奇景，令人叹为观止。'], '景区资质': ['国家3A级景区、省级风景名胜区、国家级森林公园'], '景区特色': ['宗教、摄影、观光、日出、寺庙、石窟、山、海、森林从您位置到槎山']}",41,108,"{'最佳游览时间': ['四季皆宜。'], '购物推荐': ['美食：海参汤、鱼腐汤、盛家火烧、姜汁螃蟹及各类新鲜海产品。', '特产：荣成鲍鱼、荣成大花生、荣成海带、荣成绿茶、荣成砂梨等。']}","{'景区位置': ['中国>山东省>威海市>荣成市>人和镇'], '到达方式': ['自驾路线：', '（由济南、淄博、潍坊方向出发）济青高速-青威高速-泽头路口下右转305省道石泽线-上庄转盘右转上威石公路-槎山景区', '（由济宁、临沂方向出发）日东高速-同三高速-济青高速-青威高速-泽头路口下右转305省道石泽线-上庄转盘右转上威石公路-槎山景区', '（由东营方向出发）荣乌高速-青威高速-泽头路口下右转305省道石泽线-上庄转盘右转上威石公路-槎山景区', '（由泰安方向出发）泰莱高速-博莱高速-济青高速-青威高速-泽头路口下右转305省道石泽线-上庄转盘右转上威石公路-槎山景区', '（由烟台方向出发）烟威高速-北海路口下右转204省道（初张线）-上庄转盘右转（威石公路）-槎山景区', '（由青岛方向出发）青威高速-泽头路口下右转305省道石泽线-上庄转盘右转上威石公路-槎山景区', '（由威海方向出发）威石公路（机场路）上庄转盘右转→→槎山景区']}","{'槎山门票价格': ['55元。', '优惠政策：60岁老人及1.4米以下的儿童免票；持士兵证、军官证及在槎山办理的皈依证书可免票。']}",['7：00-17：00']
威海那香海国际旅游度假区,山东省,威海市,荣成市,"{'景区简介': ['威海那香海国际旅游度假区以新西兰最著名的国家海岸——丰盛湾为蓝本，以倡导一种健康、可持续的滨海度假生活方式为理念，以旅游度假、休闲养生为主，是集避暑、养老、商务、投资、文创和居住于一体的大型旅居目的地。为繁忙的都市人建设一个集旅游、休闲、养生，商务、居住于一体的大型旅游综合体。', '那香海度假区从轻松休闲和积极休闲两方面，为老人、小孩、年轻人、家庭、情侣等一起活动，为志同道合、兴趣相投者共同交流等，规划了40多个丰富而趣味盎然的休闲场所与交流空间。充分集合深海、浅滩、陆地、森林、河流、湖泊等大自然最美丽的生态元素，为游客带来身心尊贵享受。'], '景点分布': ['那香海国际旅游度假区位于荣成港西环海大道，与威海新区交界处。度假区内设有香海湾、黑松林乐园、海滨浴场、温泉酒店和海景酒店、购物、餐饮等等活动娱乐中心和设施，可体验温泉、水上运动、婚纱婚庆等项目。'], '景区资质': ['国家4A级景区'], '景区特色': ['休闲、游泳、避暑、度假村、海滨、沙滩从您位置到那香海']}",12,15,"{'最佳游览时间': ['夏季'], '购物推荐': ['苹果、海参、海带。']}","{'景区位置': ['中国>山东省>威海市>荣成市>港西镇'], '到达方式': ['乘车路线：乘威海至成山的车，到港西镇政府下车，然后乘出租即可。', '自驾路线：滨海大道至港西即可。']}",{'那香海门票价格': ['免费']},['全天']
荣成中国中韩边贸城,山东省,威海市,荣成市,"{'景区简介': ['荣成中国中韩边贸城是威海地区第一家拥有“国字号”冠名的专业市场。边贸城依托荣成市乃至整个胶东半岛强大的海洋经济实力，以及毗邻日韩的区位优势，以海洋食品和韩国进口商品的批发销售为主，兼营山东半岛特色旅游商品和地方土特产，是人们休闲购物的好地方。'], '景点分布': ['中国中韩边贸城位于凭海西路88号，总占地578亩。市场共划分了八个区域，分别经营海洋食品、边贸商品、地方土特产、旅游商品以及办公、会展、电子商务、餐饮娱乐等，设海洋食品博览中心、海洋科技馆等，展示当地独有的海洋资源。'], '景区特色': ['购物、商场从您位置到中韩边贸城']}",0,18,"{'最佳游览时间': ['四季皆宜'], '购物推荐': ['海鲜干货、韩国商品、土特产']}","{'景区位置': ['中国>山东省>威海市>荣成市>崂山街道'], '到达方式': ['264路、266路、268路、269路、荣成265路、荣成267路、荣成270路、荣成287路，直达。', 'S201—荣兰线—S908—S301']}",{'中韩边贸城门票价格': ['免费']},['9:00-19:00']
荣成花斑彩石景区,山东省,威海市,荣成市,"{'景区简介': ['荣成花斑彩石景区以享誉海内外的“中华第一奇石”—花斑石为首，形成以石文化为特色的海洋景观区。清朝道光年间就被列为荣成八景之一。景区内的花斑石造型独特，色泽艳丽，体积巨大，堪称“中华海上第一奇石”。如今这座奇石已有长达五亿年的历史，在地质学上是一座非常典型、精致而奇特的海蚀地貌景观，自古以来就被誉为“大东胜景”。花斑彩石位于荣成市东北部马道镇联洛湾内，距刘公岛风景区30公里，成山头风景区10公里，地处交通要道，与崮山半岛、万米海水浴场等自然风景及众多的人文景观有机组合成我国北部沿海优良的度假旅游胜地。'], '景点分布': ['荣成花斑彩石风景区以石文化景观为主要内容，内设石语阁、书画馆及南极馆等专题展览。'], '景区资质': ['国家2A级景区'], '景区特色': ['奇石文化游、艺术文化游、科普文化游、海洋景观游、展览馆、海蚀地貌、海中奇石、海滨从您位置到花斑彩石景区']}",58,87,"{'最佳游览时间': ['夏季。'], '购物推荐': ['(当地特产)荣成大花生、樱桃、威海无花果、海带、海参、砂梨、草莓、裙带菜、鲍鱼。', '(特色美食)姜汁螃蟹、葱烧海参、盛家火烧、七珍煮羹、海参汤、三鲜汤、鱼腐汤、鸡丝汤。']}","{'景区位置': ['中国>山东省>威海市>荣成市'], '到达方式': ['游客可在威海汽车站乘坐开往荣成方向的公共汽车，下车后打车', '前往景区（荣成出租车起步价5元）。']}",{'花斑彩石景区门票价格': ['票价50元。']},"['夏季7：30-18：00，17:30停止入场', '春秋7：30-17：00，16:30停止入场', '冬季7：30-16：30，16:00停止入场']"
山东威海海驴岛,山东省,威海市,荣成市,"{'景区简介': ['海驴岛是一座融神话传奇和美妙自然风光为一体的仙山海岛，岛屿位于山东省荣成县成山头西北的大海中，距海岸1600余米，面积1312平方米，岛上生态环境良好，每年清明谷雨前后都会吸引大量海鸥、白鹭来此踩窝、下蛋，此外还有大马燕鸟、喜鸟、和平鸟、各种各样的鸟，是喜爱观赏海鸟的朋友们的摄影胜地。'], '景点分布': ['隔海望去，海驴岛状似一只瘦驴卧于海中，故而得名，又因为由于岛上海鸥很多，而当地人称海鸥为海猫子，所以海驴岛也被称为海猫岛。', '据神话传说，二郎神挑山填海曾行至成山，正行间忽闻东海有驴的叫声，西岸有鸡的鸣声，一惊之下，扁担折断，挑筐亦随之落入海中，遂化为两岛海岛。从此，人们便称东岛为海驴岛，西岛为鸡鸣岛。两岛之间各有一块耸天而立、高有数丈的石柱，便喻为“扁担石”。虽为神话，两岛自然形状亦与神话十分相配。'], '景区特色': ['生态游、观鸟、海岛从您位置到海驴岛']}",106,154,{'最佳游览时间': ['春夏秋']},"{'景区位置': ['中国>山东省>威海市>荣成市'], '到达方式': ['在威海汽车站乘坐威海至西霞口专线车，约45分钟可到达西霞口村的码头，再搭乘紫霞1号游船到达景区。']}",{'海驴岛门票价格': ['100元/人']},['发船时间：5:00——18:00']
荣成博物馆,山东省,威海市,荣成市,"{'景区简介': ['荣成博物馆集陈列展览、文物保护、科研教育、游览服务四大功能为一体，是荣成市的标志性文化建筑。博物馆设计内涵取乘风破浪、前程远大的象征意义，以航船与波浪为造型符号，展现出北方建筑庄重宏伟的气派和庄严敦厚、典雅大方的风格，是目前国内地市级以下同类展馆中规模最大的展馆。'], '景点分布': ['荣成博物馆坐落在市区政府广场南，总建筑面积28672平方米。博物馆设500平米展厅6个，700平米展厅6个，50平米展厅19个，另有1000平米容纳600人的多功能会议厅1个，包括荣成撤县建市20年成就展、世纪荣成展馆、民俗展馆、明清青花瓷画展、名家书画及作品展、秦汉文史馆等。'], '景区资质': ['国家3A级景区'], '景区特色': ['休闲、历史文化、民俗文化、博物馆从您位置到荣成博物馆']}",0,13,"{'最佳游览时间': ['四季皆宜'], '购物推荐': ['书籍、纪念品。']}","{'景区位置': ['中国>山东省>威海市>荣成市'], '到达方式': ['乘车路线：荣成101路、荣成102路、荣成105路直达。', '自驾路线：S201→荣兰线→荣成市区→成山大道→府东南路']}",{'荣成博物馆门票价格': ['免费']},['周二至周日，08：00—11：30，14：30—15：30；周一闭馆']
威海西霞口摩天岭,山东省,威海市,荣成市,"{'景区简介': ['摩天岭是一处集陆上驰、海里游、空中飞于一体的山海风光旅游区，半岛位于西霞口成山头景区西北方向，三面环海，地貌景观形成于亿万年前的大陆漂移过程，山崖坚挺峻拔，景观神奇独特，更以戚继光抗击倭寇古战争闻名，在这里游客既可乘高速大巴在山颠处摩天捉云；可乘游艇在苍茫间抚海戏鱼；亦可乘山崖飞索体验飘然欲仙的感觉。'], '景点分布': ['威海摩天岭生态旅游风景区历史悠久，传说众多，抗倭英雄戚继光曾在这里大败倭寇，留下血石崖的救援传说。摩天岭景区的山脊上修建有高速公路，豪华大巴车在山脊上疾驶，山海景观尽收游客眼底，怡情赏阅山的秀丽、海的辽阔；走下大巴车，游客乘上单轨小火车可直达峡谷边；山谷上空架有山崖飞索，游客可乘坐箱车沿飞索悠然往来，驭风飞行的感觉油然而生；从山下海滩到最高峰——骡子头处有快乐山车运行其间；到达海边的游客，可以乘坐豪华游轮前往海驴岛，欣赏令人陶醉的海岛风光。'], '景区特色': ['生态游、戚继光、甲午战争、古战场、山岳、海滨、溶洞从您位置到摩天岭']}",83,148,{'最佳游览时间': ['春夏秋']},"{'景区位置': ['中国>山东省>威海市>荣成市'], '到达方式': ['景区入口缆车与成山头景区相连，游客在威海汽车站乘坐至成山头的客车，便可直达景区。']}",{'摩天岭门票价格': ['60元/人']},['8：00——18：00']
荣成金石湾艺术园区,山东省,威海市,荣成市,"{'景区简介': ['荣成金石湾艺术园区是中国首个将居住、艺术品创作、展览、学术研究、投资、收藏、交易、艺术教育、休闲度假等多种功能有机结合，融合了各种高品质生活元素的当代艺术超级综合区。园区拥有3.5公里长的海岸线，各类设施一应俱全，满足人们休闲居住和文化生活的需求，是人们高品质生活的最佳之选。'], '景点分布': ['金石湾艺术园区位荣成好运角旅游度假区内，占地750余亩。园区内集文化、教育、旅游、房产四位一体，建有独栋和联排别墅，艺术酒店，美术馆群、教育中心、艺术品交易中心，五星级酒店和游艇俱乐部。'], '景区特色': ['休闲、娱乐、街区从您位置到金石湾艺术园']}",0,0,{'最佳游览时间': ['四季皆宜']},"{'景区位置': ['中国>山东省>威海市>荣成市'], '到达方式': ['乘车路线：荣成252路、荣成253路河口站', '自驾路线：威海市区→经区五洲太阳城→滨海大道成山头方向40公里→金石湾艺术园区']}","{'金石湾艺术园门票价格': ['40元', '优惠政策：对6周岁（含6周岁）以下或身高1.2米（含1.2米）以下儿童实行免票；对现役军人、残疾人、离休干部、60周岁（含）以上老人等群体凭有效证件免收门票。']}",['09:00-17:00']
荣成神雕山野生动物园,山东省,威海市,荣成市,"{'景区简介': ['神雕山野生动物自然保护区是中国最大的最有特点的放养式野生动物自然保护区之一，动物保护区位于威海荣成区西霞口村，三面环海，一面接陆，区内群峰林立，沟谷纵横，堆绿叠翠，景色迷人，不仅风光独特且极宜管理，是各类野生动物的极佳繁衍栖息地。'], '景点分布': ['神雕山野生动物园占地3800亩，辟有猛兽区、草食动物区、海洋动物区、非洲动物区、熊乐园、百鸟园、猛禽园、猩猩园、豹狼山、猴子山、金丝猴馆、小熊猫馆等动物栖息地，其中拥有国家I、II类保护动物120多种，1200多头（只），此外还有玉观音、关帝庙、秦始皇射雕遗迹及汉武帝赐建的霞主祠等旅游景点。', '来到神雕山野生动物园，听虎啸狮吼、闻猴啼鸟鸣、看熊搏豹猎、观群猴嬉戏、瞧海狮海豹赛泳、赏精灵海豚表演，感天地造化之神秀、抚茫茫沧海之无垠，给人以“体验野性、回归自然”的感受。'], '景区特色': ['动物园、亲子游、动物园从您位置到神雕山']}",42,206,{'最佳游览时间': ['四季皆可']},"{'景区位置': ['中国>山东省>威海市>荣成市'], '到达方式': ['在威海汽车站有威海至西霞口的旅游专线车。']}","{'神雕山门票价格': ['150元/人', '老人：60－69周岁老年人（凭老年证或身份证），80元优惠票；70周岁以上老年人（凭老年证或身份证），免费，凭证件至售票窗口换取免费票入园', '儿童：1.2米－1.4米儿童，85元优惠票；1.2米以下儿童，10元优待票', '残疾人：凭残疾证，85元优惠票', '现役军人：现役军人（凭士兵证）可享受动物园门票，85元优惠票', '革命伤残军人：凭残疾军人证，10元优待票']}","['4月1日-10月31日07:30-18:00(最晚入园16:00)', '11月1日-次年3月31日07:30-16:30']"
山东威海鸡鸣岛,山东省,威海市,荣成市,"{'景区简介': ['山东威海鸡鸣岛，一处原始脱俗，鸟语花香，清新幽雅的人间仙境。悠闲自在的村民们不慌不忙地出海、做饭、洗衣、聊家常，这一处处最日常的生活气息让都市忙碌的人们倍感亲切，刹那间便可将烦恼抛之于后，让身体与心灵完全投入到这派安宁美丽的风景中去。尽管鸡鸣岛并非条件优越的度假胜地，但其未经雕琢的自然风景、人文气息，还是令不少人向往，追求它所赋予的平静与美好。'], '景点分布': ['鸡鸣岛地处威海以南、荣成以北的海域中，面积约0.31平方公里。小岛四周被海水包围，有一片片胶东特色民居“海草房”，遗留着灯塔兵营、防空洞等古迹，CCTV《见证》节目也在岛上设置了驻岛站。人们除了可以在原始风景中探险外，还可以体验赶海的乐趣，享受悠然自然的宁静假日。当天打捞回来的各类新鲜海货，更是游客们最不可错过的美味佳肴。'], '景区特色': ['休闲、看海、度假、探险、捕鱼、古迹、大海、岛屿从您位置到鸡鸣岛']}",82,35,"{'旅游攻略': ['鸡鸣岛与海驴岛相互遥望，感兴趣的游客可顺便前往海驴岛观赏黑尾鸥等水鸟。'], '最佳游览时间': ['5-10月'], '购物推荐': ['（美食）螃蟹、鱼鲜等海鲜类美食。']}","{'景区位置': ['中国>山东省>威海市>荣成市>港西镇'], '到达方式': ['乘车路线：可乘坐飞机、火车抵达威海，后乘坐大巴前往港西镇虎头角，到码头乘船上岛。', '自驾路线：威青高速/威青一级路→滨海大道→环海公路，过了纹石宝滩可看到鸡鸣岛牌子，至王家村虎头角后乘船前往岛上。']}","{'鸡鸣岛门票价格': ['往返船票83元', '儿童：1.2米以下5元保险费，现场购买；1.2米以上，同成人价格', '老人：长者优惠政策，全部同成人']}",['08:00-16:00']
山东昆嵛山国家级自然保护区,山东省,威海市,荣成市,"{'景区简介': ['山东昆嵛山国家级自然保护区位于山东省威海市、烟台市，主峰泰礴顶位于山东省威海市，海拔923米，总面积15416公顷。保护区内有野生高等植物1073种，还有野生动物1161种。有分布于中国最北界的刺杉、最南界的赤松，也拥有山东省最大的世界树木活化石——水杉，是以中国赤松为主要保护对象的森林生态类型自然保护区。'], '景区特色': ['休闲、摄影、山、森林从您位置到昆嵛山']}",56,35,{},"{'景区位置': ['中国>山东省>威海市>荣成市'], '到达方式': ['自驾路线：', '威海→文化东路→新威路→青岛北路→渔港路→海滨中路→S302→天鹅湖路→大天鹅国家级自然保护区。']}",{'昆嵛山门票价格': ['无']},{}
山东荣成大天鹅国家级自然保护区,山东省,威海市,荣成市,"{'景区简介': ['荣成大天鹅国家级自然保护区，位于山东省威海市荣成成山镇境内，总面积10500公顷，其中核心区3720.2公顷、缓冲区3056.5公顷、实验区3723.3公顷。2007年4月晋升为国家级。保护区以保护大天鹅等濒危鸟类和湿地生态系统为主。2011年1月8日，中国野生动物保护协会向荣成市授予了“中国大天鹅之乡”。'], '景区特色': ['摄影、休闲、天鹅、湿地从您位置到蓉城大天鹅']}",47,16,{'最佳游览时间': ['冬天']},"{'景区位置': ['中国>山东省>威海市>荣成市>成山镇'], '到达方式': ['自驾路线：', '威海→文化东路→新威路→青岛北路→渔港路→海滨南路→齐鲁大道→S302→天鹅湖路→大天鹅国家级自然保护区。']}",{'蓉城大天鹅门票价格': ['无']},['全天']
乳山银滩旅游度假区,山东省,威海市,乳山市,"{'景区简介': ['乳山银滩被誉为“天下第一滩”、“东方夏威夷”。坐落在山东省威海乳山市东南海岸，是集旅游、度假、休闲于一体的综合性景区。因沿岸沙滩坡缓滩平，沙质细腻松软，洁白如银，得名“银滩”。度假区内林秀海碧、礁石滩曲，山、海、岛、滩、泉、林，各景俱全。仰卧在洁净、绵长的沙滩上，或与恋人沿海岸漫步，都是无比惬意的体验。'], '景点分布': ['度假区内的主要景点有：仙人桥、三观亭、和尚洞、宫家岛、幺岛、堕崮山、无极山、马山，天下第一滩，旭日广场、潮汐湖等。'], '景区资质': ['国家4A级景区'], '景区特色': ['摄影、徒步、攀岩、漂流、观光、避暑、度假、度假区、古迹、海滨、海滩']}",1168,1420,"{'游览路线': ['(游览路线)潮汐湖→海韵广场→东升广场→幸福园→足球训练基地→海滨广场→三观亭→东方如意→国际城→仙人桥→外事翻译学院。'], '最佳游览时间': ['夏季。'], '购物推荐': ['(当地特产)“东宝”牌花生制品、鲁菱果汁、“恒裕”牌罐头、大花生、茶叶、苹果、大姜、葡萄、板栗等。', '(特色美食)乳山牡蛎、乳山秦米、对虾、乳山海参、鹰爪虾、毛虾、爬虾、乳山小伏虾、蠓子虾酱、赤甲红海蟹、杂色蛤扇贝、缢蛏加吉鱼、小黄花、黑鱼花寨、偏口鱼、']}","{'景区位置': ['中国>山东省>威海市>乳山市'], '到达方式': ['乳山市内乘6路公交车或银滩1路车可直达景区。']}",{'乳山银滩门票价格': ['免费']},['全天']
威海大乳山滨海旅游度假区,山东省,威海市,乳山市,"{'景区简介': ['威海大乳山滨海旅游度假区以“母亲文化”为核心，堪称“东方夏威夷”。大乳山拥有山、海、滩、湾、岛、湖、林等优势资源，来到这里，就进入了“海山泽国，世外桃源”。游客可以在山下的海滩度个假，享受优美的风景和清净的环境；去泓兴寺礼佛，在青山碧海间的漂亮建筑和雕塑前取景留影；亦或是在视野极佳的山顶上，观太阳东升西落。而大乳山最重要的就是“母爱温情福地养生”的文化主线，被选定为中华母亲节永久性会址，同时结合威海“打造千里福地，构筑千里幸福旅游线”的规划，挖掘中华民族“福如东海”的传统文化精髓，成为敬母爱母、观光旅游、休闲度假、康体养生、文化娱乐为一体的大型综合性旅游胜地。'], '景点分布': ['大乳山地处威海以南的海滨城市乳山市，濒临黄海，总面积60平方公里，分为母爱文化体验区、养生文化体验区、宗教文化游览区、海滨休闲度假区、游乐园区等多个部分，有著名的地理标志——大乳山、小乳山、睡美人；还有大小9个海湾、4个海岛、22个人工岛、3个自然海水浴场。度假区内最核心的景观为圣母山，有二十四孝浮雕、敬母台、观女娲神像和古代四大圣母故事雕塑；此外还有日月琉璃双塔、药师佛大殿、灵光塔、泓兴寺、荷花池、花卉园等景观，诸多水上娱乐，以及耕渔酒店、婚期园水晶誓约等。'], '景区资质': ['国家4A级景区、国家级海洋公园、中国十佳休闲胜地'], '景区特色': ['休闲、登山、观光、游泳、朝拜、度假、亲水、祈福、宗教、山峰、海滨、花卉']}",96,111,"{'旅游攻略': ['景区内部小火车停靠站点：东大门和合双福停车场→药师佛大殿→泓兴寺→海天康乐园（大坝）→圣母山→景区北大门'], '游览路线': ['推荐游览线路：', '福运天来→欢乐风休闲绿地→春华秋实→荷合双福→主题雕塑（“润”）及周边景点→耕渔知趣景→东方净琉璃世界→水晶誓约→海天康乐园→母爱文化苑及周边景点'], '最佳游览时间': ['4-10月'], '购物推荐': ['购物：海鲜干货、吉祥结、工艺品等。', '美食：鲁菜、川菜、粤菜、渔家菜、农家菜、蒙古菜、西餐等。']}","{'景区位置': ['中国>山东省>威海市>乳山市>海阳所镇'], '到达方式': ['乘车路线：乳山新汽车站乘坐到大乳山的公交班车可到达景区；外省市游客可坐火车直达乳山。', '自驾路线：', '1、济南、淄博、潍坊方向：走济青（青银）高速在南泉处转青威高速，76公里处（乳山出口）下，按景区路线指示牌行走即可到达。', '2、青岛方向：走青银高速转青威高速，76公里处（乳山出口）下，按景区路线指示牌行走即可到达。', '3、威海方向：走青威高速，76公里处（乳山出口）下，按景区路线指示牌行走即可到达。', '4、烟台方向：走烟海高速，在育黎下，转309国道，进乳山市区后按景区路线指示牌行走即可到达。', '5、济宁、临沂方向：走日东高速转同三高速转济青（青银）高速，在南泉处转青威高速，76公里处（乳山出口）下，按景区路线指示牌行走即可到达。', '6、泰安、莱芜方向：走济青南线转同三高速转济青（青银）高速，在南泉处转青威高速，76公里处（乳山出口）下，按景区路线指示牌行走即可到达。', '7、滨州、东营方向：走威乌高速，青新（即平）高速转青威高速，76公里处（乳山出口）下，按景区路线指示牌行走即可到达。']}","{'大乳山海滨门票价格': ['全价票：100元', '免费政策：身高1.3米（含1.3米）以下免费；记者持记者证免费；导游持导游证免费；残疾人持残疾证免费；全国旅行社经理持有效证件免费；宗教界的出家人士持有效证件免费；65周岁（含65周岁）以上的女性老年人持身份证或老年证免费；70周岁（含70周岁）以上的男性老年人持身份证或老年证免费。', '优惠政策：身高1.3—1.4米之间儿童购景区优惠票；现役军人持军官证购景区优惠票；学生持学校开据的证明或学生证购景区优惠票；皈依居士持合法宗教皈依证购景区优惠票。']}",['07:00—18:00']
