name,province,city,location,desc,want,has_been,strategy,route,ticket_info,open_time
山东福如东海文化园,山东省,威海市,乳山市,"{'景区简介': ['“福如东海”文化园是一个以福如东海为主题的旅游项目，景区位于威海乳山银滩旅游度假区的中心（北斗湾地区），由山东威海广澳旅游投资有限公司投资，以营造南有海南寿比南山，北有乳山福如东海的南北遥相呼应的氛围而建设，景区建成后将与蓬莱仙岛景区、威海浏公岛景区形成三足鼎立之势。'], '景点分布': ['“福如东海”文化园围绕中华福文化，以“福、寿、康、宁、乐”为主题，策划了福、寿、康、宁、乐五个主题文化园及旅游商业项目。'], '景区资质': ['国家4A级景区'], '景区特色': ['文化游、建筑、主题公园、园林从您位置到福如东海']}",64,96,{'最佳游览时间': ['夏季']},"{'景区位置': ['中国>山东省>威海市>乳山市'], '到达方式': ['乘车路线：202路、203路、乳山206路福如东海站', '自驾路线：', '威海：青威高速乳山东（70出口）收费站-沿银金大道向东到福如东海文化园', '烟台：烟威高速-乳山市北环路-沿银金大道向东到福如东海文化园']}",{'福如东海门票价格': ['票价：50元']},['全天']
威海多福山国际养生旅游度假区,山东省,威海市,乳山市,"{'景区简介': ['威海多福山国际养生旅游度假区自古便以古刹、庙会、圣水、奇石、怪松而闻名，素有“小泰山”的美誉，是一个集养生、休闲度假、宗教朝圣、观光、娱乐、宜游宜居于一体的养生度假天堂，让游客感知“多福人生”、体验“多福人生”、享有“多福人生”。'], '景点分布': ['多福山国际养生旅游度假区内谷深涧幽、植被茂密，被誉为“天然的氧吧”和“度假养生的天堂”。景区内有送子娘娘画像石刻、伯牙忆琴、一线天、玄武献寿、钟馗醉酒、金蟾戏凤、寿星石、玉兔送福、心心相印、大肚佛、多福山之手、水墨山水等奇石，有长寿泉、玉液天池、圣水泉、福泉等水景，有嶞崮山石牌坊、杜鹃谷、百福图、长寿亭、地藏锡杖、南海观音等景观，有碧霞元君祠、霄龙禅寺、龙母庙等古寺，还有拓展基地、卢塞恩小镇、商业广场、森林休闲区等娱乐休闲设施。'], '景区资质': ['国家3A级景区'], '景区特色': ['休闲、自然、度假、度假村、山峦、奇石']}",39,28,"{'最佳游览时间': ['四季皆宜'], '购物推荐': ['（特产）无花果、海带、蠓子虾酱、大花生等。', '（美食）对虾、扒酿海参、锅煽海蛎子、鲅鱼水饺等。']}","{'景区位置': ['中国>山东省>威海市>乳山市'], '到达方式': ['乘车路线：在乳山市汽车站设有207路公交车直达景区。', '驾车路线：进入文化东路，左转进入新威路，直行进入青岛北路，直行进入青岛中路，直行进入青岛南路，直行进入威青一级路，朝威青高速方向，靠左进入威青高速公路，从南黄/银滩出口离开靠右进入南黄立交，朝银滩度假区方向，右转进入S206，右转进入银金大道行驶即可。']}","{'多福山门票价格': ['每人55元；', '身高1.2米（含）以下儿童免票，1.2-1.4米之间儿童享受半价优惠；', '60-69周岁以上老人持有效身份证件享受半价优惠，70周岁及以上老人持有效身份证件免票；', '持有效佛家皈依证者免票。']}",['8：00-16：00']
威海石佛山休闲观光景区,山东省,威海市,乳山市,"{'景区简介': ['威海石佛山休闲观光景区以古树、奇石、秀水、峻峰而闻名，是汇集动植物观光、休闲娱乐为一体的综合景区。景区内古树参天，芳草遍地，繁花点点，流水潺潺，鸟儿喃喃，并拥有胶东地区唯一的映山红林带及百亩樱花林。林区植被茂密，森林覆盖率达到90%以上，令人心情舒畅；山下还有优质的矿泉水层，水内含有对人体有益的各种微量元素及矿物质，是养生娱乐的佳地。'], '景点分布': ['石佛山休闲观光景区位于乳山寨镇赤家口村西，距乳山市区仅30分钟车程。景区内有特色植物园、有机蔬菜采摘区、小动物养殖区、樱花园、漂流谷、垂钓场、情人谷等景点，设正华山庄，可采摘、滑草、观赏动植物。'], '景区资质': ['国家3A级景区'], '景区特色': ['休闲、娱乐、采摘、赏花、山峰、花卉、泉湖从您位置到石佛山']}",15,1,"{'最佳游览时间': ['夏秋两季'], '购物推荐': ['蔬菜、草莓、葡萄等。']}","{'景区位置': ['中国>山东省>威海市>乳山市>乳山寨镇'], '到达方式': ['乘车路线：乳山327路赤家口站', '自驾路线：青威高速—乳山寨腾河高速口下—202省道—208省道—直行3公里—左转进入村路直行到正华石佛山景区']}","{'石佛山门票价格': ['通票80元', '各单独项目20元']}",['08:00-17:00']
乳山台依湖国际酒庄生态文化区,山东省,威海市,乳山市,"{'景区简介': ['乳山台依湖国际酒庄生态文化区以葡萄酒文化为主题，以台依湖为中心，集葡萄种植与酿造、度假与旅游于一体，缔造中国乃至世界最大的酒庄生态文化区。台依湖酒庄是近年来“私人酒庄”开发中的翘楚之一，特别是每个主题谷都充分形成浓郁的区域风情氛围，并融入葡萄的种植、酿造、休闲旅游及科普文化、采摘体验等产业链，使每个酒庄都成为相对独立的生产单元和旅游产品，打造独具特色的国际酒庄文化区。人们在此可真实体验葡萄种植和酿造，也可在酒窑举杯品味美酒佳酿，更可以相邀挚友到酒庄聚会和度假。'], '景点分布': ['台依湖国际酒庄生态文化区坐落在市区以北9公里处，规模达30000亩。区域内拥有六大酒庄主题谷，规划建立300个酒庄，另设五星级酒庄、风情小镇、水上运动游乐项目、商业休闲场所、葡萄酒文化博览馆、葡萄科普体验园等。人们还可以认领酒庄，做庄园主人，享受私人酒庄的舒适与私密。'], '景区资质': ['国家3A级景区'], '景区特色': ['休闲、观光、品酒、度假、娱乐、酒庄、湖泊从您位置到台依湖酒庄']}",0,15,"{'旅游攻略': ['游客入园后凭借门票加付44元可获得价值168元红酒一瓶。', '每年9月下旬举办国际酒庄文化艺术节。'], '最佳游览时间': ['秋季'], '购物推荐': ['红、白葡萄酒，相关纪念品。']}","{'景区位置': ['中国>山东省>威海市>乳山市'], '到达方式': ['自驾路线：乳山市区走北环路→青山北路至台依湖水库即可，威海方向走威青高速公路、烟台走烟海高速公路至景区。']}",{'台依湖酒庄门票价格': ['108元/人，含大门票、酒庄参观、高尔夫、品酒。']},['08:00~18:00']
乳山金牛谷生态农业观光园,山东省,威海市,乳山市,"{'景区简介': ['乳山金牛谷生态农业观光园以“绿色文化、花园农业”为主题，是集生态农业、观光旅游、休闲度假为一体的综合性观光园。园区依托得天独厚的地理条件，大力发展生态农业和乡村旅游，是乳山市旅游与农业融合发展的典型项目之一，也是鲁东大学农学院教学科研基地。游客来到这里，采摘新鲜绿色水果、蔬菜，体验户外运动的激情，感受难忘假日时光。'], '景点分布': ['金牛谷生态农业观光园位于乳山市午极镇，占地3000余亩。园内分为生态农业示范区、观光农业旅游区和公共服务区，有温室大棚、滑雪（滑草）场、各类果园、生态餐厅、茶艺馆、高尔夫练习场、水上运动乐园、烧烤广场、四合院农家院落、别墅等。'], '景区资质': ['国家3A级景区'], '景区特色': ['休闲、娱乐、采摘、农业园从您位置到金牛谷农业园']}",0,0,"{'最佳游览时间': ['四季皆宜'], '购物推荐': ['有机蔬果、蓝莓等。']}","{'景区位置': ['中国>山东省>威海市>乳山市>午极镇'], '到达方式': ['乘车路线：乳山330路、乳山362路、乳山368路，直达。', '自驾路线：威青高速→荣兰线→S207→金牛谷，S302→S207→金牛谷']}",{'金牛谷农业园门票价格': ['60元']},['09：00—16：30']
威海乳山小汤温泉度假村,山东省,威海市,乳山市,"{'景区简介': ['威海乳山小汤温泉度假村是一个以古老“温泉”与现代休闲养生文化为主题的现代化温泉度假村。小汤温泉水的矿化度高，浮力大，对人体作用力强，而且含有丰富的矿物质，并含有大量阳离子、阴离子和硫化氢、二氧化碳等气体。用此水沐浴，对人体可起到良好的保健作用，对风湿病、关节炎及皮肤病有很好的治疗作用。度假村集温泉洗浴、餐饮、住宿、会议、娱乐为一体，各种娱乐设施丰富齐全，是人们养生休闲的好地方。'], '景点分布': ['小汤温泉度假村位于乳山市区东北20公里的冯家镇汤上村，占地48.9亩。温泉区有按摩冲浪泡池、电脉冲池、煮蛋池、牛奶池、气泡池、儿童滑梯、游泳池等多种风格的温泉，并配有康体理疗中心、水吧等。度假村内还设绿色采摘园、温泉客房、会议、餐厅等，现代化设施完善。'], '景区资质': ['国家3A级景区'], '景区特色': ['休闲、养生、温泉、度假村从您位置到小汤温泉']}",0,1,"{'最佳游览时间': ['冬季'], '购物推荐': ['草莓']}","{'景区位置': ['中国>山东省>威海市>乳山市>冯家镇'], '到达方式': ['自驾路线：', '威青高速威海收费站→乳山南黄下→S206省道南黄冯家镇方向8分钟左右即到', '乳山市区→下初→冯家镇红绿灯向南S206省道南黄方向5分钟即到']}",{'小汤温泉门票价格': ['成人79元，身高1.3米以下的儿童免费。']},['09:00-24:00']
乳山岠嵎山风景区,山东省,威海市,乳山市,"{'景区简介': ['乳山岠嵎山风景区素有天然石雕园、植物园、天然氧吧的美誉，为国家森林公园。这里奇石林立，千姿百态，如禽似兽，似人如物，无不栩栩如生，故人就曾留下过“盘游山巨山禺观奇石，胜似二八相巧云”的叹诵，令人大开眼界。中央电视台曾在《神州风采》节目中专门介绍过骆驼负宝、石猴拜月等景观，电影《山菊花》中也有石瀑烈星等景观的画面。'], '景点分布': ['岠嵎山风景区位于乳山寨镇西约10公里山后村，占地3.3公顷。主要景观有飞石凌空、骆驼负宝、石瀑烈星、千古猿人、万年灵芝等二十四大景，以及千层饼、拇指石、玉三尊、七彩虹等七十二小景。'], '景区资质': ['国家3A级景区'], '景区特色': ['休闲、登山、猎奇、山峰、奇石从您位置到岠嵎山']}",0,0,"{'最佳游览时间': ['4-10月'], '购物推荐': ['杏、蕨菜、刺楸。']}","{'景区位置': ['中国>山东省>威海市>乳山市>乳山寨镇'], '到达方式': ['乘车路线：乳山323路直达', '自驾路线：胜利街→S202→院里水库']}",{'岠嵎山门票价格': ['20元']},['08:00-16:30']
日照万平口海滨风景区,山东省,日照市,东港区,"{'景区简介': ['日照市万平口海滨风景区是最能体现日照“蓝天、碧海、金沙滩”特色的景区，也是日照市区内最大的景区。景区以优美宜人的自然环境、湿润清新的空气、宽阔洁净的沙滩、清澈透明的海水和明媚灿烂的阳光著称于世，是日照最富盛名的旅游景区之一，有“旅游来日照，必到万平口”之说。游客们在此可以进行海水浴、日光浴、沙滩浴、沙滩排球等运动，常年人气火爆，是日照“海滨生态市、东方太阳城”的重要标志。'], '景点分布': ['万平口海滨风景区依黄海而建，南临日照港，西接植物园，海岸线长5000米，占地面积760万平方米。景区内有江北最大的天然泻湖，涨潮时，海水通过跨海桥，逶迤而来，湖水波光粼粼，一泻千里；灯塔景区分为广场、海滨休闲区、公寓区和居住区4个部分，将海洋融入生活。恢复重建（姜）太公祠、太公钓鱼台等历史遗迹，新建“海边花园”、“陆上龙宫”等一系列自然、人文景观，并引进旅游飞机、民俗风情船、水上三轮车、摩托艇等项目。'], '景区资质': ['国家4A级景区、省级名胜景区'], '景区特色': ['水上运动、休闲娱乐、广场、水上运动、灯塔、海滨、沙滩']}",1979,3553,"{'旅游攻略': ['日照是太阳升起最早照到的地方，当地有着“旅游来日照，必到万平口”的说法。游客可以在沙滩上晒晒日光浴，打打沙滩排球，到海水里尽情的玩水戏耍。', '万平口南面的灯塔是日照海滨城市的象征，晚上到灯塔景区，到处都是一闪一闪的彩灯，照在大海上，波光异彩，让人们感觉走到梦幻般的境界里。'], '游览路线': ['第二海水浴场→世帆赛基地→灯塔风景区'], '最佳游览时间': ['夏季']}","{'景区位置': ['中国>山东省>日照市>东港区>后村镇'], '到达方式': ['日照市区乘坐1路，5路，6路车，8路车和北沿海旅游专线到万平口风景区下车。']}","{'万平口海滨门票价格': ['60元', '持有效证件的60周岁（含60周岁）以上老年人、现役军人、残疾人（含重度残疾人、盲人的1名陪护人员）免收门票。', '身高1.4米（含1.4米）以下的儿童免收门票。', '身高1.4米以上的未成年人、在校学生持有效证件实行半票优惠。']}","['旺季（10月11日至次年4月19日）：05:00-22:30（停止检票入园21:00）', '淡季（4月20日至10月10日）：06:00-21:00（停止检票入园20:00）']"
日照海滨国家森林公园,山东省,日照市,东港区,"{'景区简介': ['日照海滨国家森林公园为我国首批国家森林公园之一，园区由原日照大沙洼林场改建而成，依山傍海，林海相依，总面积12000亩，森林覆盖率75.8%，动植物种类繁多，空气清新；在长达7公里的黄金海岸线上，浪缓滩阔、沙质细润、海水洁净，被有关专家誉为“中国沿海仅存未被污染的黄金海岸”，丁肇中先生也称赞这里的沙滩即为夏威夷所不及。'], '景点分布': ['日照海滨国家森林公园现已形成森林旅游区、海滨娱乐区、疗养度假区和太公文化区4个旅游功能区，其中包括了水下鲨鱼馆、姜太公纪念馆、海水浴场、森林演艺广场等景点，除游览观光，还开展了多人骑自行车、欧式马车、游览观光车、沙滩车等游乐项目，并且现有28家独具特色的海滨酒店投入运营，成为人们休闲观光、避暑度假、商务旅游和开展海上运动的理想胜地。'], '景区资质': ['国家4A级景区'], '景区特色': ['沙滩、姜太公、休闲度假、纪念馆、森林、海滨、沙滩从您位置到日照海滨']}",1057,994,{'最佳游览时间': ['夏季']},"{'景区位置': ['中国>山东省>日照市>东港区>后村镇'], '到达方式': ['自驾：京沪高速－日东高速－日照口下－迎宾大道－万平口旅游区－滨海路北行15公里即到，下高速后约需30分钟车程；或，京沪高速－日东高速－同三高速向北－日照北下－山海路－青岛路北行10公里即到，下高速后约需30分钟车程。', '乘车：日照市内乘坐日照电影院至森林公园的北沿海路旅游专线班车（对开），每15分钟一班，全程票价3元。']}",{'日照海滨门票价格': ['免费']},['全天']
刘家湾赶海园,山东省,日照市,东港区,"{'景区简介': ['刘家湾赶海园被誉为“亚洲最大金沙滩、中国第一赶海园”。它位于日照市南12公里处的黄海之滨—东港区涛雒镇东部，是以赶海系列活动为主，集旅游、休闲、度假、民俗、健身于一体的综合旅游园。'], '景点分布': ['刘家湾赶海园特色景观主要有：太阳塔、渔家民俗馆、海洋生物馆、海神庙、木栈道、游乐园、垂钓园、野趣园、三友园、仿海生物、帆式张模、海之门演艺广场、观海木屋、金沙岛国际海滨浴场、日照金沙岛沙滩高尔夫球场等。'], '景区资质': ['国家4A级景区'], '景区特色': ['观光、度假、娱乐、公园从您位置到刘家湾赶海园']}",434,540,"{'旅游攻略': ['1、退潮赶海。退大潮时，这里滩平沙细，各种海生物丰富，可以钓竹蛏、捡海螺、捉螃蟹等。在海之门外还建设了8处摸鱼池、捉蟹池，供游客捉鱼摸蟹，尽情娱乐。', '2、涨潮赶海。涨潮后，这里滩平水浅，专门开辟了推虾皮、捞海蜇、钓鱼虾蟹、拉网等传统海上作业等活动。', '3、其他赶海活动。游客在海上扬帆观海，观赏渔民捕鱼，参观渔民摆布的迷惑网，享受收获迷惑网的喜悦。', '4、观看涨潮落潮。这里的海滩特别平整，每天可以看到两次涨潮落潮奇观：落潮时海水迅速消失，仅剩下裸露的万亩滩涂和来不及回到大海的鱼虾蟹贝；涨潮时海水八方齐涌，万亩滩涂迅即淹没，极为壮观。'], '最佳游览时间': ['夏秋季节'], '购物推荐': ['莒县大姜、扇贝、乌鱼蛋、莒州全羊、莒县绿芦笋、浮莱山石砚、日照现代民间绘画、文心冰凉银杏等。']}","{'景区位置': ['中国>山东省>日照市>东港区>后村镇>涛雒镇'], '到达方式': ['341省道、市南沿海大道直达园区。刘家湾暂时不通公交车，在日照汽车站对面站牌坐12路到关爱医院站下车，往西南路口步行100米到日照电大，那里会有石臼到岚山的车停那，到刘家湾赶海园门口下车即可。每人4块。']}",{'刘家湾赶海园门票价格': ['50元/人']},['8：00-17：00']
日照竹洞天风景区,山东省,日照市,东港区,"{'景区简介': ['日照竹洞天风景区既是一个天然氧吧，又是一个天然的竹子博物馆，风景区位于日照城区西端，景区总面积1000多亩，水域面积400多亩，绿化绿化率达80%以上，其中自然生长着毛竹、淡竹、斑竹、月竹、紫竹、钢竹、金镶玉竹等100多个竹子品种，堪称南竹北移的成功典范。'], '景点分布': ['日照竹洞天风景区以竹文化、民族建筑文化、民族风情文化、民族餐饮文化为特色，分为竹文化园、民俗文化村、休憩园、水上娱乐园、原生毛竹林、又一村生态园六大功能区，共有竹楼、竹亭、竹廊等景点30余处，构成“北国江南别有洞天”的旅游主题，竹林间百鸟争鸣，河面上白鹭嬉戏，充分体现了浓郁的江南风情和民族文化特色，游客可乘竹排、乌蓬船一睹北方江南风光。'], '景区资质': ['国家3A级景区'], '景区特色': ['生态游、森林、竹海从您位置到竹洞天']}",136,170,{'最佳游览时间': ['夏季']},"{'景区位置': ['中国>山东省>日照市>东港区>后村镇'], '到达方式': ['自驾：京福高速－日东高速－日照出口下－直行至T型路口左转北行约2公里处路口左转－沿海曲路西行（沿景区指示牌行驶）－竹洞天风景区。', '乘车：日照15路公交车终点站设在景区门口']}",{'竹洞天门票价格': ['40元/人']},['8:00—5:30']
日照龙门崮风景区,山东省,日照市,东港区,"{'景区简介': ['日照龙门崮风景区有“山东海滨第一崮”、“江北丽江，度假天堂”之美誉，是一处集旅游度假、商务接待、康体健身、采摘体验、娱乐休闲、会议培训为一体的独具特色的旅游度假区。龙门崮原生态资源丰富，文化底蕴浓厚，神话传说和民间典故颇多。境内景景生色，处处诱人，特别是洞、湖、谷、竹、塔、坊、寺等自然景观和人文景观，以奇、秀、险、怪、幽、旷六大特色共存，三季有花，四季有景，是春游踏青、夏令避暑、秋季采摘、冬观雪景，享受大自然的理想场所。'], '景点分布': ['龙门崮风景区位于三庄镇上卜落崮村，占地面积16平方公里。景区分为入口服务区、刘勰文化游览区、雕龙里商业购物区、儿童娱乐及龙湖水上乐园游览区、特色风味餐饮品尝区、民俗风情居住区等，有1湖、2山、3峡、4顶、5峰、6池、72洞、108景，主要景点有文化墙、刘勰书卷、鸡鸣寺、石人、石鸡、龙门石、试心石、情侣石、王母洞、仙女洞、望海洞、仙螺洞、文心洞、龙凤塔、龙门深潭、水上云渡、安澜桥等，另设漂流、滑索、游船等娱乐项目。'], '景区资质': ['国家4A级景区'], '景区特色': ['休闲、亲水、娱乐、古迹、度假村、山峰、洞穴、泉瀑']}",2,38,"{'最佳游览时间': ['四季皆宜'], '购物推荐': ['板栗']}","{'景区位置': ['中国>山东省>日照市>东港区>后村镇>三庄镇'], '到达方式': ['自驾路线：山海路/S335→S222→景区']}","{'龙门崮门票价格': ['风景区：40元', '水上乐园：80元']}",['08:30—17:00']
日照花仙子风景区,山东省,日照市,东港区,"{'景区简介': ['日照花仙子风景区被当代诗人用“日照东港花仙子，月映西湖凤凰台”来描述，是一处集观光造景、园林施工、种子生产、育苗、外景婚纱摄影于一体的新型观光造景景区。景区湖光山色，美景怡人，春夏秋三个季节繁花似锦，色彩斑斓，各色花卉，交相辉映，令人心旷神怡，流连忘返。同时，这里也是目前长江以北最大的婚纱外景拍摄基地，且拥有国内极其少见的内外都可以拍摄的实景基地，而特色的水下摄影、空中摄影，也令人眼前一亮，别具一格。'], '景点分布': ['花仙子风景区坐落于西湖镇北乐台，占地面积39万平方米。景区内主要有长城、彩虹园、花海、蝴蝶馆、爱丽丝梦幻城堡、荷兰风车、爱琴海岸、音乐湖、葡萄采摘园等景点，建有蒙古包、垂钓园、跑马场、儿童游乐场、生态花卉婚纱摄影暖棚、青少年体验馆等设施。'], '景区资质': ['国家3A级景区'], '景区特色': ['休闲、赏花、摄影、娱乐、公园、花卉']}",21,4,"{'最佳游览时间': ['春夏两季'], '购物推荐': ['葡萄、蝴蝶标本等。']}","{'景区位置': ['中国>山东省>日照市>东港区>后村镇>西湖镇'], '到达方式': ['乘车路线：日照汽车北站乘坐花仙子旅游专线，终点即是花仙子风景区', '自驾路线：日东高速（五莲/西湖出口）/335省道-222省道-花仙子风景区']}","{'日照花仙子门票价格': ['50元', '学生持有效证件可享半价优惠，60岁以上老人、在役军人、残疾人、1.4米以下儿童免票，本地居民持日照旅游一卡通免票，周边村民持有效证件免票。']}",['8:00-17:00（冬季闭园，具体时间以景区公告为准）']
日照阳光海岸梦幻海滩公园,山东省,日照市,东港区,"{'景区简介': ['日照阳光海岸梦幻海滩公园以日、月、水、云四个元素为主题，是一处如诗如画的多维空间，一幅五彩斑斓的优美画卷。全长2650米的海岸，海滩林海相映，沙细滩平，海水洁净，空气清新。人们来到这里，观海上旭日之喷薄，听黄海波涛之澎湃，赏林间岚霭之缥缈，感海曲文化之悠远，尽情体味“落霞与海鸥齐飞，碧水共长天一色”的境界。'], '景点分布': ['阳光海岸梦幻海滩公园位于碧海路北苗家村太公岛海水浴场附近，占地面积61万平方米。景区内建设了映旭、浴月、临涛、泊烟4个开放的广场，37个“UFO”造型建筑、欧美情调小木屋、林中木栈道以及廊桥等设施。金沙滩上可玩沙滩排球、沙滩足球、沙雕、赶海拾贝、篝火晚会等丰富多彩的活动，体验渔家生活。'], '景区资质': ['国家3A级景区'], '景区特色': ['休闲、亲水、娱乐、避暑、海滩、岛屿从您位置到日照阳光海岸']}",2,5,"{'最佳游览时间': ['夏季'], '购物推荐': ['海鲜']}","{'景区位置': ['中国>山东省>日照市>东港区>后村镇'], '到达方式': ['乘车路线：16路、33路、42路教授花园站，8路、10路、35路、36路、旅游1路王家皂站。', '自驾路线：日兰高速→日照立交桥→迎宾路→碧海路']}",{'日照阳光海岸门票价格': ['免费']},['全天']
