name,province,city,location,desc,want,has_been,strategy,route,ticket_info,open_time
日照御海湾生态观光茶园,山东省,日照市,东港区,"{'景区简介': ['日照御海湾生态观光茶园被誉为“中国近海第一茶”，在国内绝无仅有，是华夏万里海岸线上不可复制、不可多得的生态茶园观光风景区。茶园及周边松林片片，莺歌燕舞，茶园碧绿叠翠，远远望去，海路相接，蓝绿相间，恰似一幅漫卷的水彩画，令人赏心悦目，十分壮观。同时，园区集茶园、茶园观光、茶博馆、茶文化开发、制茶、售茶、茶艺、茶文化表演、宾馆、饭店、茶馆及产、学、研基地于一体，是休闲度假、农业体验的好地方。'], '景点分布': ['御海湾生态观光茶园位于日照市碧海路御海湾，占地500亩。园内有茶园300亩，设有茶寿道、沧桑道、千年古茶树、天韵石、鱼古亭、沧桑亭以及海底泉等多处景点，并建有宾馆和餐厅，游客可亲手采茶、炒茶，并在茶园的松林内，用罕见的“海底泉”水煮泡“御海湾”茶，边品茗边看茶艺、茶文化表演。'], '景区资质': ['国家3A级景区'], '景区特色': ['休闲、娱乐、采摘、农业园从您位置到御海湾茶园']}",0,0,"{'最佳游览时间': ['4-10月'], '购物推荐': ['茶叶']}","{'景区位置': ['中国>山东省>日照市>东港区>后村镇'], '到达方式': ['乘车路线：36路直达', '自驾路线：碧海路→北海路→碧海路']}",{'御海湾茶园门票价格': ['26元']},['08：00—18：00']
日照海洋公园,山东省,日照市,东港区,"{'景区简介': ['日照海洋公园是世界独创的将海洋馆与花鸟园相融合的新型海洋公园、世界少有的将海洋动植物和陆生动植物综合展示的主题公园，也是国内少有的大型萌宠乐园。作为一个创新型海洋旅游综合体，游客在这里能够欣赏600余种数余万来自海洋世界的神奇生物，感受有趣而刺激的观赏和互动体验，从主题区、展示馆及表演项目的命名和设计上，也都能感受到“海洋、科普、科技、艺术”在细节中的渗透。同时，日照海洋公园又把海洋科普、生命关爱等知识和价值观，通过互动体验、场景演绎等多样形式传递给游客，这也是海洋公园文化核心的初衷。'], '景点分布': ['海洋公园位于日照奥林匹克水上公园北侧，占地161.7亩，由阳光海洋馆、四季花鸟园、海洋主题餐厅、室外动物表演展区、水禽观赏园、室外无动力主题游乐区和特色商业街组成。其中，阳光海洋馆内拥有国内少有的室外温带企鹅展示、壮观的群游风暴、海狮海豹室内外立体融合展示，海洋剧场内有长达36米的巨幕，有超过5000吨海水的超大展池和近200平方米的巨型展窗，有特色的梦幻水母展示和珊瑚隧道等等。四季花鸟园引进国际特色的鲜花大厅、空中花海，展示近百种稀有鸟类、鱼类、萌宠和千余种、数万株植物。'], '景区资质': ['国家4A级景区'], '景区特色': ['科普、亲子、娱乐、展馆从您位置到日照海洋公园']}",2,0,"{'游览路线': ['四季花鸟园→海洋主题餐厅→室外动物表演展区→水禽观赏园→室外无动力主题游乐区→特色商业街'], '最佳游览时间': ['四季皆宜']}","{'景区位置': ['中国>山东省>日照市>东港区>后村镇'], '到达方式': ['公交车：乘坐3路、10路公交车浴月广场站下车。', '自驾车：日照高速出口→迎宾路、海曲路→碧海路（北行3公里）→日照海洋公园']}","{'日照海洋公园门票价格': ['成人220元/人', '大学生票150元/人，优待票120元/人。', '优待政策', '儿童：1.2米（含）以下，免费；身高在1.2米（不含）-1.4米（含）之间的儿童，优惠', '学生：全日制本专科高等教育学校（不含研究生、博士生）在读大学生，优惠', '老人：年龄：60周岁（含）~69周岁（含），优惠；70周岁（含）以上，凭老年证或身份证，免费', '军人：现役军人和在职消防员持相关证件，免费。现役军人有效证件包括：军(警)官证、文职干部证、士官证、义务兵证、学员证；在职消防员有效证件包括：国家综合性消防救援队伍干部证、国家综合性消防救援队伍消防员证、国家综合性消防救援队伍退休证、学员证。', '残疾人：残障人士、人民解放军、武警部队现役军人、军队院校学员、军队离退休干部等，优惠', '退役军人：退役军人持有效证件和身份证，优惠。退役军人有效证件包括：中华人民共和国残疾军人证、中国人民解放军军官转业证书、中国人民解放军文职干部转业证书、中国人民解放军士官退出现役证、中国人民武装警察部队士兵退出现役证、中国人民武装警察部队义务兵退出现役证、中国人民解放军义务兵退出现役证、中国人民解放军复员军人证明书、复员军人证明书、中国人民解放军转业军人证明书、退伍军人证明书、志愿兵退出现役证明书、中国人民解放军复员建设军人证明书等。']}",['09:00-16:00']
日照多岛海风景区,山东省,日照市,岚山区,"{'景区简介': ['日照多岛海风景区拥有全国唯一的海上摩崖石刻，是国内不可多见的南向临海岸线。景区以水为灵魂、以岛为载体，环水为岛，多岛连海，塑造多层次的滨水景观。优美宜人的自然环境、湿润清新的空气、宽阔洁净的沙滩、清澈透明的海水，明媚灿烂的阳光，每年都会有大量中外游客慕名而来，是休闲、购物、游玩的理想之地，也是最能代表日照“蓝天、碧海、金沙滩”特色的景区之一。'], '景点分布': ['多岛海风景区位于岚山区多岛海大道，海州湾畔。景区总规划面积5810亩，有东、西两个岛，由服务区、海上乐园、赶海活动区、风帆广场、生态广场、海上碑公园等组成，并设娱乐、服务等设施。'], '景区资质': ['国家3A级景区'], '景区特色': ['休闲、亲水、娱乐、避暑、海滨、岛屿、沙滩从您位置到多岛海']}",11,4,"{'最佳游览时间': ['夏季'], '购物推荐': ['海鲜，贝壳工艺品']}","{'景区位置': ['中国>山东省>日照市>岚山区>中楼镇'], '到达方式': ['乘车路线：岚山区2路多岛海星河湾广场站', '自驾路线：沿海公路→厦门路→化工大道→万斛路→砚台山一路→凤阳路→多岛海大道']}",{'多岛海门票价格': ['免费']},['全天']
日照祥路碧海生态茶园,山东省,日照市,岚山区,"{'景区简介': ['日照祥路碧海生态茶园，不是江南，胜似江南，是江北最大的有机茶生产基地。祥路碧海茶园是集茶叶种植、加工、观光、展览、品茶于一体的综合性企业，一垅垅翠绿的茶叶如同绿色的波涛拥向远方，波涛中一位位采茶女正在缭绕的云雾中忙碌着，好像仙女下凡，让人心胸舒畅。走进展馆，一件件实物与图片展示了中国茶叶与日照祥路碧海茶叶的发展历程，也让人们更加了解茶文化的内涵。'], '景点分布': ['祥路碧海生态茶园位于沈海高速日照服务区，距离日照市区15公里。茶园占地800余亩，分东西两区；西区以生态茶园为主，东区以参观旅游、休闲、茶叶加工与展示茶文化为主。有亭台楼阁、池塘、木栈道、“茶”字文化石、品茗苑、日照公路茶文化展馆等景点，生产绿茶、红茶，可供游客选购。'], '景区资质': ['国家3A级景区'], '景区特色': ['休闲、购物、避暑、农业园、展馆从您位置到日照茶园']}",1,0,"{'最佳游览时间': ['3-10月'], '购物推荐': ['红茶、绿茶，茶具。']}","{'景区位置': ['中国>山东省>日照市>岚山区>中楼镇>高兴镇'], '到达方式': ['自驾路线：沈海高速至日照服务区']}",{'日照茶园门票价格': ['免费']},['全天']
日照五莲山旅游风景区,山东省,日照市,五莲县,"{'景区简介': ['五莲山风景名胜区属温带半湿润海洋性气候，平均气温12.6℃，冬暖夏凉，气候宜人，雨量充沛。境内山清水秀，河川纵横，素有台湾花莲，“山东五莲”之美誉。总面积68平方公里，由五莲山、九仙山两景区组成，主峰海拔515.7米。景区内自然景观和人文景观众多，以奇、秀、险、怪、幽、旷、奥七大特色著称。是齐鲁大地最大的野生药库，山东省野生杜鹃花基地，省级风景名胜区、省级森林公园，佛教活动中心。春夏之交万亩野生杜鹃花盛开，似云锦，像流霞，漫山遍野，令人陶醉。秋霜季节，满山红叶层林尽染，与山光石景相辉映，蔚为壮观。'], '景点分布': ['五莲山景区内的主要景点有：孙膑书院、五莲山、九仙山、野生杜鹃花基地、光明寺佛园、望海楼、龙潭大峡谷、五莲山大佛等。'], '景区资质': ['国家4A级景区、省级名胜景区、省级风景名胜区、国家森林公园、佛教活动中心'], '景区特色': ['摄影、徒步、观光、攀岩、休闲、古迹、名山、森林、花卉从您位置到五莲山']}",541,926,"{'最佳游览时间': ['春、夏、秋三季。'], '购物推荐': ['(当地特产)五莲花生、板栗、槐花蜜、纸扎、樱桃。', '(特色美食)九仙小笨鸡、九仙豆沫子、九仙煎饼。']}","{'景区位置': ['中国>山东省>日照市>五莲县'], '到达方式': ['1.在日照汽车站乘开往五莲方向的车，到达五莲县后乘发往叩官镇的公共汽车，', '在五莲山下车即到。大约一个半小时车程，票价10元左右；', '2.另外，日照汽车站周末会有开往五莲山的旅游专线车。']}",{'五莲山门票价格': ['票价60元。']},['8：30—16：00。']
日照大青山风景区,山东省,日照市,五莲县,"{'景区简介': ['日照大青山风景区以“秀、幽、奇、旷”四大特色著称华北，更兼古园柏、祥云寺、万和寺、古城墙等历史遗迹和汉高祖刘邦走马摔冠、屯兵西征的民间传说，使其更加色调迷离，韵脉神秘。每逢三、四月份，华北大地还笼罩在残冬的寒意中时，大青山已随着融雪的溪水，透露出春意。进入五月，满山的照山白、夏杜鹃、野蔷薇和不知名的野花蔓草，使山川谷壑飘溢着一缕缕谷兰麝香。群峰拱围，百壑竞流，近百种树木繁茂成林，森林覆盖率高达90％以上，举目望去，满山青色，使大青山因而得名。大青山景区就坐落在鲁东南黄海之滨，五莲县城西南7公里处。'], '景点分布': ['大青山自然景观独特，人文景观众多，共有景点200余处。目前景区主要由五个区域组成：“万佛山古文化区”（主要景点有古长城遗址，古寨遗址，万和寺、古园柏等），“锁羊宫洞窟区”（主要景点有龙珠洞、隐龙洞、佛珠洞等），“拥翠峡探险区”（主要景点有三叠瀑、积水潭、回马崖、升仙台等）还有“龙秋峡”水悦区，“石岛峰”草坪生态区。正在建设中的景点有：“小洞庭”休闲垂钓区、“小北国”、赏茶、品茶区，以及筹建中的四星级标准的“大青山酒店”服务区和“中国书法精品”摩崖石刻区。'], '景区资质': ['国家4A级景区'], '景区特色': ['摄影、登山、宗教文化游、历史文化游、古迹、寺庙、山川从您位置到大青山']}",108,49,"{'最佳游览时间': ['春、秋季节。'], '购物推荐': ['(当地特产)文蛤贝壳、五莲花生、板栗、槐花蜜、纸扎、五莲樱桃。', '(特色美食)九仙小笨鸡、九仙豆沫子、九仙煎饼。']}","{'景区位置': ['中国>山东省>日照市>五莲县'], '到达方式': ['游客可从日照汽车总站乘坐开往五莲县的班车（票价10元左右），下车后包车前往景区', '(大青山距县城仅7公里)。']}","{'大青山门票价格': ['票价40元。', '儿童：1.2米（不含）以下，免费；身高：1.2米（含）-1.5米（含），半价', '学生：持本人学生证，半价', '老人：70岁（含）以上，免费；年龄：60周岁（含）-70周岁（不含），半价', '残疾人：凭本人残疾证，免费', '军人：现役和退役军人凭相关证件，免费']}",['07:00-18:00']
五莲杏石温泉度假村,山东省,日照市,五莲县,"{'景区简介': ['五莲杏石温泉度假村是山东省占地面积最大、综合配套最为丰富的温泉度假旅游胜地。这里的温泉出水井深1516米，出口温度56度，属弱碱性硫酸钠型热矿水温泉，富含三十余种有益于人体健康的微量矿物元素，其中九种元素达到了医疗价值浓度，六种元素更是达到了命名浓度标准，具有极高的医疗保健功能。山环水绕是度假村与生俱来的天然屏障，拒绝了外界世俗的浸染与喧嚣，达到真正的休闲养生圣地，让人们享受彻底的身心放松。'], '景点分布': ['杏石温泉度假村位于五莲县206国道，近管帅镇北店村北3公里处。度假村占地1050亩，主要建设项目有室内外温泉洗浴区、温泉综合楼、五星级特色温泉酒店、温泉度假别墅、产权式公寓、养生保健中心、商业步行街、主题广场等，有大小露天温泉泡池72个，并提供户外拓展、商务会议等服务。'], '景区资质': ['国家3A级景区'], '景区特色': ['休闲、温泉、养生、度假村从您位置到杏石温泉']}",0,0,{'最佳游览时间': ['四季皆宜']},"{'景区位置': ['中国>山东省>日照市>五莲县'], '到达方式': ['自驾路线：山海路→S222→滨河路→S334→烟汕线']}",{'杏石温泉门票价格': ['135元']},"['全天', '温泉和泳池:09:00-19:00']"
五莲凤凰山百果谷生态旅游区,山东省,日照市,五莲县,"{'景区简介': ['五莲凤凰山百果谷生态旅游区是集餐饮、民俗、娱乐、购物为一体的开放式景区。一个个竹栅栏围起的采摘园，一处处地道农家风味的饭店，在青山峰回路转之间时隐时现，仿若来到“采菊东篱下，悠然见南山”的世外桃源。人们来到这里，采摘娱乐，农家休闲，回归纯朴的田园生活，享受与众不同的假日。'], '景点分布': ['凤凰山百果谷生态旅游区位于松柏镇，距日照市区约50公里，总面积1.2万亩。区内建设游客服务中心、百果休闲庄园、主题酒店、农业科普公园，有樱桃5500亩、板栗1000亩、杂果800亩、生态公益林2600亩，农家乐饭店10家，每年还举办樱桃节等活动，精彩纷呈。'], '景区资质': ['国家3A级景区'], '景区特色': ['休闲、娱乐、采摘、农业园从您位置到五莲百果谷']}",0,0,"{'旅游攻略': ['（一）赏花', '1.驼石沟杏花（百年老树老屋）花期：3月底至4月中上旬，7－10天', '2.窦家台子桃花花期：4月15日左右，7－8天', '3.百果谷、刘家南山大小樱桃花花期：清明前后，15天', '4.李家峪、刘家南山黄花鞭花期：4月上旬，7－10天', '5.陆家沟槐花（沁人心脾）花期：5月上旬，7－10天', '（二）采摘', '1.小樱桃采摘期：5月中上旬，20天左右', '2.大樱桃采摘期：5月中下旬至6月初，30天左右', '3.桃子采摘期：7月下旬至8月，20天左右', '4.苹果采摘期：9月下旬至10月下旬，30天左右', '5.板栗采摘期：10月上旬，20天左右', '6.柿子采摘期：10月上旬，20天左右', '（三）节庆活动', '樱桃采摘节时间：５月中上旬左右', '啤酒烧烤节时间：７月下旬', '金秋采摘节时间：10月'], '最佳游览时间': ['夏秋两季'], '购物推荐': ['樱桃']}","{'景区位置': ['中国>山东省>日照市>五莲县>松柏镇'], '到达方式': ['自驾路线：北京北路→S334']}",{'五莲百果谷门票价格': ['樱桃园：40元']},['全天']
浮来山风景区,山东省,日照市,莒县,"{'景区简介': ['浮来山景区是山东极具魅力的景区之一。浮来山位于莒城西9公里处，海拔298.9米，因在莒城登高西眺浮来，呈平地崛起之势，有水上浮来之感，因此而得名。景区内气候温和，四季分明，由飞来、佛来、浮来三峰鼎足而成，形似卧龙，独具清雅灵秀之神韵。'], '景点分布': ['“一山一树一条根、一书一字一巢人”，景区主要景点有天下银杏第一树、千年古刹定林寺、世界之最檀根王、道教圣地朝阳观、地质遗迹保护区、自然动物园区等，还建有滑草场、霹雳炮、动物园、浮来山庄等参与性休闲、游乐及餐饮设施。'], '景区资质': ['国家4A级景区、省级名胜景区'], '景区特色': ['观光、徒步、摄影、名山从您位置到浮来山']}",337,661,"{'最佳游览时间': ['4--10月份'], '购物推荐': ['莒县大姜、扇贝、乌鱼蛋、莒州全羊、莒县绿芦笋、浮莱山石砚、日照现代民间绘画、文心冰凉银杏等。']}","{'景区位置': ['中国>山东省>日照市>莒县>棋山镇>莒县经济开发区'], '到达方式': ['莒县县城乘1路公交车到浮来山风景区下车即是。']}",{'浮来山门票价格': ['50元/人']},['8:20—18：00']
日照马亓山风景区,山东省,日照市,莒县,"{'景区简介': ['日照马亓山风景区以佛教文化、自然山水、奇峰怪石、茂林丰果、民俗风情及农民起义军史迹为内涵，是一处文化综合风景区。马亓山又名马鬐山，有着悠久的历史和人文资源，山峰峦参差，有险峰十六、陡涧数十之称。山上松树茂密，奇石遍野，山北林密花繁，山间草药遍地，林中鸟鸣虫呤，山坡林果飘香，河湖鱼跃鸭肥，一派美丽的山野风光，是一处绝妙的旅游天堂。'], '景点分布': ['马亓山风景区位于莒县东南部，距莒县县城30公里。马亓山面积25平方公里，分为金盆顶、望海楼、鹰愁涧、小马亓几大景区，主要景点有点将台、甘泉寺、杨广峡、金蟾泉、甘卤泉、老母洞、马口石、古寨峰、马亓峰、寿星石、讲经洞、12班洞、寿星洞、奔马峰、仙女峰、玉女池、一线天、狮子峰、羊拦峪、大坡岭、幸福湖等几十处，设东两山休闲度假村、刘家峪水上渔家、小黄山跑马场等设施。'], '景区资质': ['国家3A级景区'], '景区特色': ['休闲、登山、猎奇、娱乐、度假村、山峰、奇石、湖泊从您位置到马亓山']}",0,16,{'最佳游览时间': ['四季皆宜']},"{'景区位置': ['中国>山东省>日照市>莒县>棋山镇>莒县经济开发区'], '到达方式': ['自驾路线：日夏线→石磊路→马亓山']}",{'马亓山门票价格': ['60元']},['08:00-17:00']
莒县沭河湿地公园,山东省,日照市,莒县,"{'景区简介': ['莒县沭河湿地公园以借山水胜景，揽天地入怀；扬莒县文化，绘沭河景观为目标，是莒县最大的城市休闲公园和森林公园。登高而俯望，一条水面宽阔、气势雄壮的蜿蜒长河进入眼底，一河清水、两岸绿色、三季花香、四季常青等景观让人们充分感受大自然魅力，又集生态旅游、文化观光、影视拍摄、休闲娱乐于一体，成为莒县县城的会客厅、大花园、观景台。'], '景点分布': ['沭河湿地公园位于莒县文心路，总面积1180公顷。公园采用“珍珠项链式结构”，由南至北沿线布置了城市绿洲、沭水拖蓝、古今夕照、世纪飞鸿、文化圣域、阡陌人间、莒人广场、健身乐园、大河之舞、长波望月、泓天一水等11个主要景观功能区和50个景观节点，有绿地856公顷，水域324公顷。'], '景区资质': ['国家3A级景区'], '景区特色': ['休闲、娱乐、公园、河流、森林从您位置到沭河湿地']}",0,2,{'最佳游览时间': ['四季皆宜']},"{'景区位置': ['中国>山东省>日照市>莒县>棋山镇>莒县经济开发区'], '到达方式': ['自驾路线：日兰高速→旅游路→银杏大道→红枫路']}",{'沭河湿地门票价格': ['免费']},"['公园：全天', '绿野迷踪：冬令时9:00—17:00，夏令时8:00-19:00']"
日照嗡嗡乐园,山东省,日照市,莒县,"{'景区简介': ['嗡嗡乐园是山东省首家蜂文化主题乐园，也是目前国内规模最大的蜜蜂特色园区。整个园区以“蜂文化”蜜蜂为为主题，以特色生态景观为核心，把蜂产业和农业观光旅游业有机结合起来，依山傍水，风景秀丽，春来喜鹊衔枝，夏有布谷啼鸣，秋去大雁南飞，冬暖天鹅嬉戏。是小朋友们的快乐天堂，青年朋友甜蜜生活的新起点，中老年人的健康养生福地。'], '景点分布': ['嗡嗡乐园位于山东省日照市莒县旅游大道，分为蜜蜂科普博物馆、蜂产品展览馆、蜂疗体验馆、嗡嗡乐蜂场、蜜语农庄、蜂蜜酒庄等特色景观，并依托天然水系，修建有7处堤坝，一座水库，以及处于园区西南角自然形成的甜蜜湖。同时，百花园、百草园、采摘园、绿茶园等搭配形成了独具特色的园林景观，游览其中，心旷神怡。'], '景区资质': ['国家4A级景区'], '景区特色': ['休闲、科普、娱乐、公园']}",0,0,"{'游览路线': ['景区大门口→玉兰广场→甜蜜湖→牡丹园→长庚步行道→蜂巢迷宫→阳光草坪→三元广场→儿童乐园→重走长征路→欢乐桥→蜜域花廊→茶园→蜜蜂良种繁育中心-→蜂疗养生中心→蜜蜂科普博物馆→花溪茶座→加工车间参观'], '最佳游览时间': ['四季皆宜']}","{'景区位置': ['中国>山东省>日照市>莒县>棋山镇>莒县经济开发区'], '到达方式': ['公交车：C202路公交车在段家河村下车即可到达。', '自驾：G1511日东高速→莒县立交→日兰高速→龙山出口下高速→旅游路→银杏大道行驶1.2公里，即可到达景区。']}","{'嗡嗡乐园门票价格': ['60元/人', '门票优惠政策：60周岁以上，1.2米以下儿童，残疾人、军人持有效证件免费入园。']}","['夏季8:00-18:00', '冬季8:00-17:00']"
临沂王羲之故居,山东省,临沂市,兰山区,"{'景区简介': ['王羲之故居，是为纪念我国历史上最伟大的书法家王羲之而建，为古典园林式建筑，坐落在临沂市区洗砚池街中段。这里青墙环绕，绿树如荫，园内溪水潺潺，垂柳依依。内有砚池怀古、鹅池水暖、曲水流觞、圣光普照、晒书台、五贤祠等历史景观，是中国书法寻根之旅的绝佳去处。'], '景点分布': ['故居占地80亩，修缮一新的洗砚池、晒书台、鸳池、禊亭等遗迹，可一窥当时王宅的模样。新建的晋墨斋、书法展室和百米长的书法碑廊，可使欣赏到书圣的手迹、碑帖以及当代南北大家不同风格的书法作品。'], '景区资质': ['国家3A级景区'], '景区特色': ['历史文化游、名人故居从您位置到王羲之故居']}",560,535,"{'最佳游览时间': ['秋季。'], '购物推荐': ['(当地特产)苍山大蒜、牛蒡、蒙山蜂蜜、八湖莲藕、绿茶、芍药山核桃、临沭柳编、兰陵美酒。', '(特色美食)莒南驴肉、蒙阴光棍鸡、锅塌鱼、孝河藕、金蒙红烧兔头。']}","{'景区位置': ['中国>山东省>临沂市>兰山区>柳青街道>枣园镇>方城镇>汪沟镇'], '到达方式': ['市内从客车站乘坐6路观光巴士到“王羲之故居”站下车即可。']}",{'王羲之故居门票价格': ['票价30元。']},"['夏季8：00-18：30', '冬季8：00-16：00']"
